<?xml version="1.0" encoding="UTF-8"?>
<matricula xmlns:xsi="http://www.w3.org/2001/XMLSchema-instance"
xsi:noNamespaceSchemaLocation="Ejercicio5.xsd"> 
    <persona> 
        <dni>12345678M</dni> 
        <titulacion>Ingeniería Informática</titulacion> 
        <curso_academico>1997/1998</curso_academico> 
        <domicilios> 
            <domicilio tipo="familiar" codPostal="46022"> 
                <nombre>C/ Principal nº1</nombre> 
            </domicilio> 
            <domicilio tipo="habitual" codPostal="46023"> 
                <nombre>C/ Secundaria nº2</nombre> 
            </domicilio> 
        </domicilios> 
    </persona>
	<persona> 
        <nombre>Juan Martinez Nebot</nombre> 
        <titulacion>Ingeniería Informática</titulacion> 
        <curso_academico>1997/1998</curso_academico> 
        <domicilios> 
            <domicilio tipo="familiar" codPostal="46022"> 
                <nombre>C/ Principal nº13</nombre> 
            </domicilio> 
        </domicilios> 
    </persona>  
    <pago>
        <tipo_matricula>Matrícula Ordinaria</tipo_matricula>
    </pago>
</matricula> 
